{
  "schema": "mosaico-ideas/device-release/1",
  "release_id": "weather-20261013-1",
  "application": {
    "id": "weather-station",
    "code": "042731"
  },
  "firmware": {
    "manifest": {
      "path": "firmware/manifest.json",
      "size": 738,
      "sha256": "b3e54149780560bf2fe3d0b1c6a30fb13784dd1eabe93cbc509844cf04aa0f80"
    }
  },
  "device": {
    "profile": "esp-mosaico/v2",
    "default_locale": "zh-CN",
    "presentations": [
      {
        "display": {
          "path": "device/zh-CN/display.json",
          "size": 2048,
          "sha256": "4444444444444444444444444444444444444444444444444444444444444444"
        },
        "assets": [
          {
            "path": "device/zh-CN/title.mif",
            "size": 3072,
            "sha256": "5555555555555555555555555555555555555555555555555555555555555555"
          },
          {
            "path": "device/zh-CN/body.mif",
            "size": 6144,
            "sha256": "6666666666666666666666666666666666666666666666666666666666666666"
          },
          {
            "path": "device/zh-CN/icon.png",
            "size": 6105,
            "sha256": "7777777777777777777777777777777777777777777777777777777777777777"
          }
        ]
      },
      {
        "display": {
          "path": "device/en/display.json",
          "size": 2048,
          "sha256": "bbbbbbbbbbbbbbbbbbbbbbbbbbbbbbbbbbbbbbbbbbbbbbbbbbbbbbbbbbbbbbbb"
        },
        "assets": [
          {
            "path": "device/en/title.mif",
            "size": 3072,
            "sha256": "cccccccccccccccccccccccccccccccccccccccccccccccccccccccccccccccc"
          },
          {
            "path": "device/en/body.mif",
            "size": 6144,
            "sha256": "dddddddddddddddddddddddddddddddddddddddddddddddddddddddddddddddd"
          },
          {
            "path": "device/en/icon.png",
            "size": 6105,
            "sha256": "7777777777777777777777777777777777777777777777777777777777777777"
          }
        ]
      }
    ]
  }
}
